sinta_id,title,topics
6042761,development mathematics learning media improve mathematics attitude deaf students. two parts reflective abstraction new problem solving mathematical concept. discovery learning model geogebra assisted improvement mathematical visual thinking ability. mathematical abstraction ability prospective math teacher students. effectiveness application learning models collaborative problem solving ability solve mathematical problems middle school students. mathematical critical thinking ability students vocational highschool adolescence. reflective abstraction find mathematcis learning. effectiveness constructivism based learning models students mathematical creative thinking abilities indonesia metaanalysis study. analysing diagnostic assessment ratio sine right triangle. exploring ethnomathematics baduy indonesia use traditional mathematics skills weaving. traditional measurement units study construction rumah gadang minangkabau. mathematical literacy ninthgrade students solving pisa mathematics problems. algebraic thinking characteristics eighth grade junior high school students based superitem test solo model. studies level visual thinking geometry. achievement pedagogical competency professional competency selfefficacy inservice mathematics teachers pedagogical problem solving cycle. students difficulties solving mathematical problem based esd objectives. effect experiential learning model based concretepictorialabstract elcpa mathematics attitude deaf students. students difficulties solving mathematics word problems context education sustainable development esd. epistemological obstacle topic triangle quadrilateral. effectiveness application mathematical software indonesia metaanalysis study. student difficulties understanding word problem based esd goals. learning difficulties senior high school students based probability understanding levels. evaluation problembased learning model towards high school students critical thinking skills metaanalysis study indonesia. mathematical representation ability prospective student teacher resolving transformation geometry problems reviewed epistemology aspect. analysis students ’ algebraic thinking skills realistic mathematics education approach help students learn function. preliminary design learning function based didactical tetrahedron model. impact problem based learning model elearning students critical thinking ability. problembased learning enhance students higher order thinking skills mathematics learning systematic review metaanalysis. metaanalysis study effect problembased learning model students mathematical problem solving skills. bibliometric analysis research mathematical literacy indonesia. didactical design distance concept solid geometry develop mathematical representation ability vocational high school. metaanalysis geogebra software decade assisted mathematics learning learn go. improving students mathematical problem solving abilities online projectbased learning models stem approach. effectiveness hybrid learning improving teacherstudent relationship terms learning motivation. achievement emotions female students mathematical problemsolving situations. metaanalysis past decade mathematics learning based computer algebra system cas. realistic mathematics learning students ways thinking. effectiveness dynamic geometry software applications learning mathematics metaanalysis study. hawthorne effect mathematical software based learning metaanalysis study. technologyassisted problembased learning common problembased learning cultivating mathematical critical thinking skills metaanalysis. pedagogical content knowledge pck profile prospective teachers mathematics learning. epistemological obstacle transformation geometry based van hiele ’ level. implementation school literacy movement development stage fostering secondary school students mathematical literacy skills. metaanalysis last two decades realistic mathematics education approaches. mathematical creative thinking level polyhedron problems eightgrade students. students learning obstacle understanding concept prism surface area. students mathematics problem solving ability model eliciting activities meas. analysis indicators forming mathematical resilience high school students. review problembased learning trends 20102020 metaanalysis study effect problembased learning enhancing mathematical problemsolving skills indonesian students. analysis mathematical communication skills class 8 students twovariable linear equation systems spldv concept. improving mathematical critical thinking skills problembased learning. preservice mathematics teachers creativity designing mathematics assessment based education sustainable development. creative thinking process junior high school students solving mathematical problems. effectiveness projectbased learning pjbl model students mathematical ability systematic literature review. comparison enhancement students mathematical critical thinking skill use meansends analysis mea treffinger learning,"mathematics education approach, thinking abilities indonesia, deaf students parts"
6721738,use synthesia application simplify angklung learning. impact information technology awareness parents high school students pursue higher education. retracted sylabus matrials design vocational student dissemination using website. retraction sylabus matrials design vocational student dissemination using website journal physics conference series 1114 012023 doi 1010881742659611141012023,"angklung learning impact, vocational student dissemination, use synthesia application"
5994748,location suitability analysis wind farm exploitation using fuzzy analytic hierarchy process. comparative analysis ahp fuzzy ahp solar power plant site selection. transformational leadership headmasters professional learning communities primary schools manjung perak. use mobile learning smp negeri 3 karawang barat improving students mathematical representation ability. development internet things iot based learning media efforts improve student skills industrial revolution era 40. hybrid method annbp lambda iteration anomalous shortterm economic dispatch hydrothermal power systems. scada application geothermal power plant. development digital video applications deaf students. ict literacy level analysis elementary school teachers. designing scada system simulator fast breeder reactor. tunning pid controller using particle swarm optimization algorithm automatic voltage regulator system. hybrid psoann application improved accuracy short term load forecasting. level ict literacy ability elementary school teachers use ict investigation cimahi. design implementation webbased internship information system vocational school. impact using augmented reality applications educational environment. performance analysis light emitting diode high sodium pressure metal halide lights. voltage analysis improvement 150 kv transmission subsystem using static synchronous compensator statcom. photographic skill competency vocational high school. design implementation automatic control laptop battery charger. lowcost portable process control laboratory kit. lowcost portable process control laboratory kit. conveyor prototype steam power plant. development dispatcher training simulator thermal energy generation system. design hybrid power system remote area. mppt based fuzzy logic controller photovoltaic system using psim simulink. analysis anomalous short term load forecasting using two different approaches. magnetic properties co tio. schedulling economical thermal power plant 500 kv javabali system using lagrange multiplier. design virtual scada simulation system pressurized water reactor,"power plant development, reality applications educational, fuzzy logic controller"
6746091,hierarchical phub center problem perishable products using cplex method origindestination approach,"center problem perishable, hierarchical phub center, cplex method origindestination"
5994886,students ’ apologizing arabic english interlanguage pragmatic case study islamic boarding school indonesia. english google translation indonesian lecturers academic writing preliminary study. corpusbased study sundanese exclamatory sentences functional typology perspective. portrayal defamation case defendant court verdict. indonesian students perceptions mnemonic strategies recognize japanese kanji characters,"students apologizing arabic, court verdict indonesian, strategies recognize japanese"
5990764,new normal era pandemic covid19 forming responsibility social life culture indonesian society. increase awareness response disaster using kamishibai learning method social studies junior high school. emerging volunteerism indonesian millennial generation volunteer participation responsibility. sustainable development principles green constitution,"emerging volunteerism indonesian, responsibility sustainable development, pandemic covid19 forming"
5982345,developing competency evaluation preservice science teachers industrial revolution 40 revealing pedagogic professional competencies. local wisdom valuesbased literacy education learning model elementary school. needs analysis students university learning writing scientific papers. effectiveness contextual teaching learning approach students argumentative writing skills. investigating cooperative learning model based interpersonal intelligence language learners skill write article. holistic attractive childrens story book stem elementary school. science childrens stories elementary school. use interactivecompensatory model basedlearning material improve informational text reading comprehension ability 5th grade elementary school bandung regency indonesia,"literacy education learning, pedagogic professional competencies, scientific papers effectiveness"
6654442,implementation simulation method improve student ’ learning outcome solar system junior high school. community empowerment synergy model based parenting programs reducing numbers stunting cirebon regency. group dynamicsbased youth empowerment model improving social entrepreneurship competence. society empowerment business fishbone chips meat shredded fish roaster. determinative factors students ’ reading interest community education units bandung. hypnoparenting training improving parent ’ ability parenting. rural youth entrepreneurship training based local potential. conceptual model community learning center pkbm indonesia community cultural learnin. conceptual model community learning center pkbm indonesia community cultural learning center kominkan japan,"youth empowerment model, entrepreneurship training based, learning center kominkan"
5974813,quality learning community presentations task investigating students discourse celestial objects coordinates astronomy construct scientific reasoning. university students selfreflection ability thermal insulation concept. smart edu design 21st century learning system innovation optimizing one roles universities. apply model teaching levels inquiry identifying experimental skills solar system matter middle school. preservice physics teachers mental models heat conduction case study processanalogy heat conduction. analyze conceptions misconceptions preservice teacher light. profile critical thinking skills preservice physics teachers preliminary study. correlation increasing mastery concepts wave optics habits mind prospective physics teacher students. science teacher educator authentic assessment attitude toward nos assessment science instruction. students critical thinking skills toward analyzing argumentation heat conductivity concept. microscopic virtual media mvm physics learning case study students understanding heat transfer. use classroom assessment explore problem solving skills based preservice teachers cognitive style dimension basic physics course. preliminary design icibased multimedia reconceptualizing electric conceptions universitas pendidikan indonesia. 3d kinematic analysis standing jumping smash technique indonesian badminton national elite athletes. comparative study velocity reduction feather synthetic shuttlecocks using corrected initial velocity overhead smash. analysis learning obstacle students learning motivation prospective math teachers basic physics class. fatigue impact mechanical movement maximal instep kicking soccer. fabrication characterization volatile organic compound gas sensor based gan thin film. contribution intelligence emotional qoutients performance athletes pencak silat. iv characteristics verification simple analytical calculation model experimental data alba. determination thin film ba. study work pattern fatigue one oil gas company indonesia. profile cognitive style logical thinking ability conceptual knowledge electricity magnetism topic based prospective physics teachers grade level. association haemoglobin a1c uric acid levels among patients diabetes mellitus type 2 primary health care clinic north sumatera indonesia. exploration students creativity integrating stem knowledge creative products. combination inquiry learning model computer simulation improve mastery concept correlation critical thinking skills cts. preparation graphene oxidepoly 34ethylenedioxytriophene poly styrene sulfonate pedotpss electrospun nanofibers. preparation graphene oxidepoly 34ethylenedioxytriophene poly styrene sulfonate pedotpss electrospun nanofibers. investigating effectiveness active learning basedinteractive conceptual instruction albici electric field concept. instrumental develovement 50 meters free style swimming speed measurement based microcontroller arduino uno. comparison whole body reaction anticipation reaction time kata kumite karater. rubber bat effect maximal ball velocity table tennis. muscle strength endurance testing development based photo transistor motion sensor ultrasonic. sintering temperatures investigation electrical characteristics fe. effect diabetes selfmanagement education hba1c level fasting blood sugar type 2 diabetes mellitus patients primary health care binjai city north sumatera indonesia. improving students argumentation providing analogical mappingbased lab inquiry science class. identifying preservice physics teacher mental model electric conceptions. heat temperature experiment designs support students conception nature science. extract ethanol poguntano alloxan induced diabetic rats. construction basic concepts waves gambo traditional musical instrument. creatinine plasma uncontrolled type 2 diabetes mellitus controlled type 2 diabetes mellitus patients primary health care binjai city indonesia. developing maximal leg power device using ultrasonic sensor liquid crystal display. contribution virtual microscopic simulation vms unveil students conceptual development misconceptions physics concepts heat transfer. cd4 relevance advanced glycation end products tuberculosis patients comorbidity diabetes. effect heat treatment condition characteristics mno. development validation conceptual knowledge test evaluate conceptual knowledge physics prospective teachers electricity magnetism topic. association serum uric acid level blood pressure type 2 diabetes mellitus. liquid conductivity sensor based agpd paste fabricated al. concept progression high school students related concept parallel electric circuits effect applying ccroi integrated tzpd strategy. model tunneling current bilayer armchair graphene nanoribbon tunnel field effect transistor using transfer matrix method. synthesizing results empirical research engineering design process science education systematic literature review. enhancing conceptual understanding via diffraction grating innovative media diagram. learning management system supported smartphone lms3 online learning application physics school course enhance digital literacy preservice physics teachers. digital literacy cognitive abilities preservice physics teacher physics school course using lms3 correlated. enhanching physics students creative thinking skills using cbl model implemented stem vocational school. implementation integrated science curriculum critical review literature. preservice physics teachers see sustainability issues case islamic university indonesia. development modelbased learning introductory physics effectiveness improving students understanding heat heat transfer. development problembased learning management systemsupported smartphone pblms3 application using addie model improve digital literacy. connections prior knowledge collaborative skill discussion group solar system related descriptive scientific reasoning. development multitier openended work energy instrument mowei using rasch analysis identify students misconceptions. metaassessment students renewable energy projects. simulation hemoglobin detection using surface plasmon resonance based kretschmann configuration. development modelbased learning introductory physics effectiveness improving students understanding heat heat transfer. students perception learning management system supported smartphone satisfaction analysis online physics learning. preservice physics teachers see sustainability issues case islamic university indonesia. development leg power force reaction testing device based affordable platform android badminton. smart edu smart city learning system build collaborative knowledge lectures deepening science material. pedagogical professional physics teacher training hybrid learning important. development 5epow predictobservewrite learning model assisted virtual simulation reduce quantity high school students misconceptions fluid topics. problems online learning use information communication technology ict physics learning sumedang west java. measuring critical thinking skills 11th grade students temperature heat. digital literacy preservice science teacher. investigating scientific reasoning observation astronomy practices student preservice physics teacher. teaching electrical resistance conductor concept using cdccoi model supported dynamic model dynamic analogy improving mental model. creative thinking skills prospective physics teacher. preservice science teachers conceptual understanding integrated science subject case study. scaffolding learning model improve habits mind students. students concept mastering analysis astronomy case study physics education department universitas pgri semarang. university students ability setting learning goals heat conductivity concept,"physics teacher students, assessment explore problem, sumatera indonesia improving"
6133646,face recognition concept reservation system trainer kit computer vision. development augmented reality technology vocational school sociotechnical curriculum framework. fuzzy analytical hierarchy process based priority identification employability skills vocational education students. smart traffic light system design based single shot multibox detector ssd anylogic simulation. use smartphone learning activities systematic review. instructional thematic game children mild mental retardation enhancement leftright recognition skill. conceptual model instructional thematic game children intellectual deficiencies. improving concentration picture selecting game based kinect sensor student intellectual deficiencies. animal thematic game based kinect sensor mental retardation rehabilitation,"technology vocational school, children intellectual deficiencies, face recognition concept"
6682292,octopus fishing ground utilization central sulawesi indonesia approach using spawning potential ratio. virtual scuba diving activities elementary student enhance ocean literacy. determination potential fishing zones areolate grouper epinephelus areolatus based analysis productivity gonad maturity fish length karimunjawa national park indonesia,"octopus fishing ground, indonesia approach using, spawning potential ratio"
6112016,priority vhs development based potential area using principal component analysis. underdeveloped region education teacher existance access educational policy. knowledge creation higher education leaders facing changes. increasing school effectiveness principals ’ leadership teachers ’ teaching performance possible. synchronization strategic plan implementation legal entity state university good u. phenomena leadership consistency implementing quality management vocational high sc. future jobs coming industry revolution 40. vhs teachers ict literacy infrastructure motivation internet access. indonesian principals create improve teachers selfefficacy. mapping vocational competencies based regional potential using geographic information system. character industrial 40 skilled workers,"indonesian principals create, vhs teachers ict, regional potential using"
6166301,improving intuition skills realistic mathematics education. improving junior high school visual thinking representation ability mathematical problem solving ctl. feasibility pblreathnomath model train hots elementary school students. improving mathematical critical thinking skills problembased learning. comparison mathematical literacy enhancement students problembased learning guided discovery learning model. mathematical connection ability deaf student completing social arithmetic tests. analysis students conceptual procedural understanding linear programming. capability mathematical strategic thinking quantum learning based creative problem solving. students critical thinking skills toward relationship limits continuity derivatives functions. profile students technological content knowledge school mathematics. effect different ways presenting teaching materials students mathematical problem solving abilities. culturebased contextual learning increase problemsolving ability first year university student. errors students learning react strategy solving problems mathematical representation ability. improvement algebraic thinking ability using multiple representation strategy realistic mathematics education. association conceptual understanding reasoning ability mathematics analysis dnrbased instruction models. analysis student error algebraic problem solving based polya newman theory. students mathematical problemsolving ability based teaching models intervention cognitive style. effect problembased learning mathematical problem posing improving students critical thinking skills. didactic trajectory learning device development using projectbased learning. selfdetermination mathematics learning process using generative multi representation learning gmrl model. students mathematical argumentation geometry. improving mathematical lateral thinking ability high school students quantum learning based creative problem solving. analysis students mathematical resilience ability linear program material blended learning. pblteam teaching supporting vocational students logical thinking creative disposition. increasing selfconfidence indonesian low ability student greens motivational strategies. students spatial reasoning model eliciting activities cabri 3d. qualitative effect problembased learning model toward students mathematical imitative creative reasoning. representation skills students reviewed prior knowledge realistic mathematics education linear material program. comparison mathematical resilience among students problem based learning guided discovery learning model. didactic trajectory research mathematics education using researchbased learning. geogebra integral areas improve mathematical representation ability. implementation react strategy develop mathematical representation reasoning disposition ability. analysis ability thinking abstractly mathematics selfefficacy tpack. mathematics learning trough elearning pandemic covid19 grade 9 junior high school bandung. analysis students mathematical reasoning ability geometry distance learning. improving creative thinking ability junior high school students geogebra assisted learning community mathematics. realistic mathematics learning students ways thinking. preliminary design learning function based didactical tetrahedron model. effectiveness hybrid learning improving teacherstudent relationship terms learning motivation,"problem solving students, mathematical literacy enhancement, intuition skills realistic"
6755923,relation behavioural problems reading skills gender contexts forecasting longitudinal data kindergarten fifth grade. portrayal women indonesian national physics textbooks textual analysis. effectiveness literacy teaching design integrating local culture discourse activities enhance reading skills. enhancing scientific argumentation skill partnership comprehensive literacy. reading comprehension competence determine level solving mathematical word problems competence. role multimodal text develop literacy change social behaviour foreign learner,"effectiveness literacy teaching, reading skills gender, indonesian national physics"
5996446,mobile gis app guiding geopark unesco global geopark ciletuh palabuhanratu indonesia. geoliteracy school environment students spatial intelligence,"guiding geopark unesco, mobile gis app, ciletuh palabuhanratu indonesia"
