sinta_id,title,topics
5975145,effect natural zeolite kaolin catalyst isothermalcatalytic cracking real municipal solid waste msw biooil production. thermal – catalytic cracking real msw biocrude oil. cocracking real msw biooil natural kaolin. simulation jatropha curcas shell gasifier synthesis gas hydrogen production. production valuable pyrolytic oils mixed municipal solid waste msw indonesia using nonisothermal isothermal experimental. emission factor single pellet cake seed jatropha curcas fix bed reactor. vaccine cold chain management cold storage technology address challenges vaccination programs. immersion cooling technology current future development energy saving. prospects challenges utilizing solar energy covid19 vaccine cold storage remote clinics tropical countries review. stepwise pyrolysis lbcr downstream enhance gasoline fraction liquid fuel mmsw. enhancement syngas production via cogasification renewable densified fuels rdf opentop downdraft gasifier case study indonesian waste. investigation reducing electricity consumption refrigerator using domestic refrigerant mc22. design development testing integrated downdraft gasifier multi igcs system msw remote areas. dataset integrated downdraft gasifier multi integrated gas cleaner system igcs municipal solid waste msw. production solid fuel hydrothermal treatment using terminalia catappa peels waste renewable energy sources. experimental upgrading liquid crude oil obtained calophyllum inophyllum twostage pyrolysis,"indonesia using nonisothermal, gasifier synthesis gas, energy covid19 vaccine"
5993891,blackbody radiation experimental apparatus arabeta support physics learning senior high school students. promoting digital literacy skills action research people kampung literasi. use erubic determine energy expenditure physical activity. effect double leg cone hop plyometric exercise long pass accuracy soccer. comparison peer teaching individual training development forehand topspin table tennis ability. effect exercise method handeye coordination towards accuracy forehand topspin table tennis,"ability effect exercise, support physics learning, blackbody radiation experimental"
6130817,improvement google classroom feature make comfortable use google app script. computerbased learning 3d visualization animation content development digital learning materials traditional indonesian cloth songket palembang. development interactive learning multimedia mathematics subjects grade 5 elementary schools,"improvement google classroom, app script computerbased, materials traditional indonesian"
5995090,generation z needs education survey. profile interpersonal communication skills elementary school students. exploring values peace cultural contexts indonesian finnish schools study development peace pedagogy. family forums community empowerment indonesia new approach management successful early childhood grassroot community education,"generation needs education, community empowerment indonesia, values peace cultural"
5979687,cytotoxic activities prenylated flavonoids artocarpus heterophyllus. isolation ethyl acetic based agf bionutrient application growth capsicum annum l plants. prenylated flavones indonesian artocarpus antimalarial properties. oxepinoflavone artocarpus elasticus cytotoxic activity p388 cells. prenylated flavones artocarpus lanceifolius cytotoxic properties p388 cells. learning nucleophilic substitution reaction based 3dvisualization improve students critical thinking ability. students preconceptions context magnetic media lubricants related chemical contents. synthesis antiparkinsonian activity nanocomposite chitosantripolyphosphatemucuna pruriens l extract cstppmp. foliar application bionutrientc213 coffee plant. subchronic toxicity ethanolic extract velvet bean mucuna pruriens indonesia. isolation metyhlpiperate nhexane extract fruit cabe jawa piper retrofractum vahl. green synthesis novel calix4resorcinarene 7hydroxycitronellal using microwave irradiation. evaluation antiparkinsons activity indonesian velvet bean mucuna pruriens extract. effect indonesian velvet bean extract fertility albino male mice. effect indonesian velvet bean extract fertility albino male mice,"activities prenylated flavonoids, artocarpus lanceifolius cytotoxic, nanocomposite chitosantripolyphosphatemucuna pruriens"
6009786,digital literacy children based steam family education. utilization youtube media learning antropology higher education. modelling fixed bed anaerobic reactor coconut shell media clogging assessment batch continuous system. kmeans algorithm improved initialization clustering fruit plants. analysis spatial autocorrelation diarrhea events east kalimantan 20152017 using local indicator spatial autocorrelation. diversity inheritance cowpea vigna unguiculata protein yield components characters. anaerobic digestion slaughterhouse wastewater co. oxygen adsorption kinetics study used pressure swing adsorber psa nitrogen production. chitin chitosan green shell perna viridis utilization fisheries wastes traditional market jakarta. kinetics study jatropha oil esterification ethanol presence tin ii chloride catalyst biodiesel production. quality social interaction martial art athletes. effect digestion time anaerobic digestion high ammonia concentration. naive bayes classifier algorithm particle swarm optimization classification cross selling case study pt telkom jakarta. level decreasing kinetics model heavy metal contents coal stockpile wastewater electrocoagulation,"anaerobic digestion slaughterhouse, jakarta kinetics study, clustering fruit plants"
6000936,reduce reuse recycle 3r waste activities school environment elementary school students. apel anak peduli lingkungan program mathematics science learning experience natural environmental preservation grade 1 2 elementary school students,"waste activities school, environmental preservation grade, reduce reuse recycle"
6725313,comparison profile quality life phosphorylatedtau superoxide dismutase plasma women elderly without dementia. integrating comprehensive geriatric assessment hiv care systems indonesia synthesis recent evidence. effectiveness home basedexercise using mobile application improve cognitive functions patients hypertension quesy experimental design. smartbed internet things pressure ulcer. effect eft emotional freedom technique self esteem among nurses. effect aerobic exercises estradiol plasma quality sleep cognitive function menopausal women. qualitative exploration mothers experience caring children autism. effect emotinal freedom technique public speaking anxiety psa among nursing students. implementing bensons relaxation therapy decrease depression elderly. effect centella asiatica aerobic exercise older women dementia randomized controlled trial. attitudes practices toward droplet airborne universal precaution among nurses covid19 outbreak indonesia. usability usefulness mobile heath app hiv prevention among adolescents indonesia. effect progressive muscle relaxation reducing restless legs syndrome among patients undergoing hemodialysis satellitehospital unit indonesia,"nurses effect aerobic, geriatric assessment hiv, indonesia usability usefulness"
5983995,preface. development validation science technology engineering mathematics stem based instructional material. develop test measure critical creative thinking skills 21. implementation stem education indonesia teachers perception stem integration curriculum. engaging students stem based learning media technology. analysis irs7 using rasch model material elasticity. junior high school students scientific literacy earth science concept. investigating scientific literacy students topic water pollution stem based 6e learning design. stembased science learning implementation identify students personal intelligences profiles. application stembased online learning train creative skills students covid19 pandemic periods. measuring collaborative problemsolving skills cpss vocational high school students using webbased assessment. enhancing creative problem solving skills using lego® mindstorm ev3 stem based learning. analysis ability junior high school students performance science stem projectbased learning. engineering course model stem education middle school curriculum setting indonesia. enhancing creative problem solving skills using legoâ® mindstorm ev3 stem based learning. engineering course model stem education middle school curriculum setting indonesia. measuring enhancing high school students cooperative attitude responsibilities learning closed electrical circuits stem approach. profile students critical thinking ability project based learning integrated science technology engineering mathematics. enhancement stem literacy knowledge aspect implementing science technology engineering mathematics stembased instructional module. enhanching physics students creative thinking skills using cbl model implemented stem vocational school,"students stem based, problemsolving skills cpss, using legoâ mindstorm"
6720860,teaching learning music digital era creating keroncong music gen z students interpreting poetry,"students interpreting poetry, teaching learning music, creating keroncong music"
5994299,discovery learning model learning writing environmental exposition text. cognitive research trust implementation influencing students writing skill elementary school. optimizing educational innovation problembased learning experiential learning approach works literacy language development,"learning writing environmental, discovery learning model, research trust implementation"
5991803,context evaluation implementation english islamic studies program iain palu indonesia. building learning society design field batik craftworkers indonesia. application electronic supply chain management managing information electronic company utilizing extraprise value network. building batik craftsmen learning society design case. communitybased mental health education empowering people mental disorders community. digital literacy early childhood education teachers society 50. assessment digital literacy competence nonformal education study program students. development cyberblog learning media improve logical thinking concepts computer science students. implementation workbased learning model education training institution. influence maritime learning activities development student competencies case study. social interaction pattern increase family awareness domestic violence. poverty alleviation improved family welfare women entrepreneurship empowerment model. analysis information processing learning model improving arabic reading skills,"indonesia building learning, islamic studies program, women entrepreneurship empowerment"
6745750,geometry feature extraction shorea leaf venation based digital image classification using random forest. geometric morphometric analysis leaf venation four shorea species identification using digital image processing,"feature extraction shorea, leaf venation based, forest geometric morphometric"
257939,spatial activities models airport based gis dynamic model. gismulti criteria evaluation analytical network process determination land capability class suitability residential land. analytical hierarchy process ahp determine zoning region vocational education. multi criteria evaluation vocational school zone based geographic information system. land suitability evaluation housing residential based gis satellite imagery dtm. feasibility prospective analysis logistics engineering study program demands digital business era. multi criteria evaluation vocational school zone based geographic information system. land suitability evaluation housing residential based gis satellite imagery dtm. railway geometric design based satellite imagery digital terrain model. multi criteria evaluation universal soil loss equation based geographic information system. multi criteria evaluation regional function based geographic information system,"airport based gis, land analytical hierarchy, education multi criteria"
5978971,designing content setting application youtube learning batik vocational school. classification indonesian quote twitter using naïve bayes. fuzzy system application education. integration telegram bot ecomplaint applications college. automated curriculum alignment standards k12 schooling system. implementation blended learning using androidbased tutorial video computer programming course ii. application expert system education. integrating samr learning model vocational education. applicability competencybased assessment tvet interns comparing indonesia laos. digitalisation trend education industry 40. existence alum effectiveness extracted miana leaves batik coloring. designing virtual reading room vrr digilitikon learning batik vocational high schools curriculum material improvement. mobilebased augmented reality learning 3dimensional spatial batikbased objects. extraction curcumin pigment indonesian local turmeric infrared spectra thermal decomposition properties. uncovering sundanese values analyzing symbolic meaning ménak priangan clothing 18001942. green chemistry principles alternative approach practice laboratory safety health. augmented reality traditional food nutrition education. perceptions acceptance levels webbased nutrition educational application digipedia edumakugiz west java traditional food teenagers bandung indonesia. record learning activity smartphone lesson study program. application expert system career guidance students. 3d digital storytelling media batik learning vocational high schools. promoting local culture digital learning media. digital library learning resources. curriculum innovation vocational high school digital library batik learning. effect solvents fixation agents colouring batik guava leaves extract. technological innovations batik fashion design case industry 40 based education curriculum. preface. teaching basic mathematics technology elementary students autism. effect microscaled size sand concrete solidity compressive strength. application desktopbased batik information system. geographic information system batik jawa barat cultural industrial mapping supporting development curriculum vocational high schools. implementation markerless augmented reality method visualise philosophy batik based android. design liquid volume meter device using ultrasonic waves based microcontroller. economic evaluation production magnesium oxide nanoparticles via liquidphase route. stem education based emodule hearing impaired students. ict literacy level analysis elementary school teachers. analysis development augmented reality androidbased computer learning vocational schools. development geographic information system based website field education. level ict literacy ability elementary school teachers use ict investigation cimahi. internet things application mechanical learning automotive engineering. geographic information system education. development cyberphysical system cps implementation industry 40. stem learning children special needs indonesia. effect population density water quality economic impact. fashion pattern maker software application development. preface. application jbatik software batik products. utilization remote sensing technology. multiplatform application technology – based heutagogy learning batik curriculum development framework. development learning guide projectbased blended learning vocational high schools covid19 pandemic. indonesia tvet teacher training policy implementation meet industry demands. digitalizing museums bibliometric study. sociotechnical framework youth unemployment case vocational school graduates. pedagogical approach influenced technical education curriculum analysis based literature review system. indonesian sign language converter text voice social interaction tool inclusion student vocational high schools. electronic rubric social skills erss vocational schools. development augmented reality technology vocational school sociotechnical curriculum framework. preface. fuzzy analytical hierarchy process based priority identification employability skills vocational education students,"batik learning vocational, indonesia laos digitalisation, nutrition educational application"
5993405,cyclically ordered groups direct product. cyclically ordered groups direct product. linear cyclically ordered subgroups cyclically ordered groups. cyclically ordered group c. kumjianpask algebras finite finitely aligned kgraphs without cycle modules. representations cyclically ordered semigroups. interplay group crossed products semigroup crossed products toeplitz algebras. decomposition semigroup crossed products. center kumjianpask algebras associated finitely aligned k graph. complex kumjianpask algebras 2graphs. kumjianpask algebras desourcification,"group kumjianpask algebras, products semigroup crossed, linear cyclically ordered"
5993192,scaffolding conceptual science. improving song notation reading comprehension skill prospective elementary school teachers action research study indonesia. technology literacy student practice lecturing critical evaluation skills. information technology primary school management. use synthesia application simplify angklung learning. problem posing skill elementary school students. improving student intelligences trough questioning identification. spatial sense instrument prospective elementary school student. acceptance finding ability. analysis mathematical problemposing ability. flipped classroom educational model 20102019 bibliometric study. moral education 20102019 bibliometric study part 1. readiness competence new teachers career professional teachers primary schools. moral education 20102019 bibliometric study part 2. acceptance finding ability afa elementary school students,"indonesia technology literacy, study readiness competence, schools moral education"
5979123,fever english 20 indonesia university students faculty members attitudes towards english different multilingual landscapes. writers voice engagement strategies students analytical exposition texts. towards deimperialization instructional strategies cases taskbased learning reflective practice implementation indonesian context. critical thinking intercultural awareness pedagogical dilemmas stories three university teachers indonesia. professional identity curriculum teaching intercultural communication indonesian case study,"teaching intercultural communication, practice implementation indonesian, context critical thinking"
6654231,exploring integrating potentials role playing youtube building students self confidence,"youtube building students, students self confidence, potentials role playing"
6000414,performance structures circular columns square columns structure rancacili silinder ii building. effect marble waste aggregate percentage fly ash admixture toward compressive strength pervious concrete,"structures circular columns, strength pervious concrete, ash admixture compressive"
6043743,creative intelligence analysis ethnomathematics learning,"creative intelligence analysis, intelligence analysis ethnomathematics, analysis ethnomathematics learning"
6124175,comparisonal analysis mechanical properties material mixer blade aisi 1522 carbon steel white cast iron due hardening process. designing adjustable height engine stand reduce risk students musculoskeletal disorders msds engine tune practice. potential prospect analysis labor market education fields renewable energy engineering industrial automation robotics automotive engineering. androidbased eobservation application lesson study learning vocational high schools. record learning activity smartphone lesson study program. automated curriculum alignment standards k12 schooling system. analysis magnesiums mechanical properties tensile test. digital curriculum mapping improve curriculum alignment. 3d digital storytelling media batik learning vocational high schools,"lesson study program, magnesiums mechanical properties, engineering industrial automation"
6681158,corpusbased study sundanese exclamatory sentences functional typology perspective. portrayal defamation case defendant court verdict. students ’ apologizing arabic english interlanguage pragmatic case study islamic boarding school indonesia. recontextualising naplan functional analysis evaluations media texts. cyberbullying identification twitter using random forest classifier. text complexity senior high school english textbooks systemic functional perspective. enhancement trabecular bone dental panoramic radiographs using multiscale line operator,"texts cyberbullying identification, corpusbased study sundanese, textbooks systemic functional"
5996452,traffic congestion analysis urban networks. iot based air quality monitoring. cipp evaluation learning development model vocational laboratories based iso 9001 2008. low interaction honeypot defense mechanism slowloris attack web server. designing smart greenhouse systems using scada based iot. multimetric approach handoff decision heterogeneous wireless networks. preface. optimization data communication air control device based internet things application http mqtt protocols. vertical handoff model next generation wireless networks. utilization augmented reality technology learning media early childhood. defining vocational teacher competencies industry 40 perspective policymakers. development application critical thinking skills tools using fuzzy expert system. intelligent handoff strategy heterogeneous wireless networks. vertical handoff decision using fuzzification combinatorial fusion. handoff decision using kalman filter fuzzy logic heterogeneous wireless networks. exploration augmented reality model learning. training development internet things creative industry entrepreneurship models upi students. mobile anchorbased localization android. ultrawideband spiral antenna back lobe reduction communication systems. defining vocational teacher competencies industry 40 perspective teachers lecturers. low carbon learning logical framework learning process elementary schools. face recognition based violajones algorithm dataset image classification. coplanar waveguide antenna using resistive load wireless communication systems. experimental study fm complex differentiation using hackrf. river water monitoring system using internet things determine location river pollution. preface. quasiyagi uda mimo 2x2 antenna 5g network cellular devices application. handoversupporting streamlined networking,"iot based air, vocational teacher competencies, upi students mobile"
5995430,potential improvement cihideung village layout modification local housing settlement. development microbial organic waste processing model community sukasari subdistrict bandung. accelerated adiabatic dynamics triangular spin cluster. investigating students failure fractional concept construction. school culture ecology. schools policy developing students ecological intelligence. construction fractional concept perspective apos theory. identification parameter arrangement hypothetical model campus earthquake disaster mitigation insight. fastforward approach adiabatic quantum dynamics regular spin clusters nature geometrydependent driving interactions. analysis distribution rain stations based physiomorphohydro zoning. test effectiveness biopore framework ecocampus development universitas pendidikan indonesia. fast forward adiabatic spin dynamics application quantum annealing model triangle spin systems. indonesian speech synthesis system considering lowpower event vowelstartingsyllable. commodity cluster using single system image based linuxkerrighed highperformance computing. fast forward adiabatic spin dynamics entangled states. wave function regulation accelarate adiabatic dynamics quantum mechanics. arrangement model instrument tentative campus evaluation earthquake tsunami disaster mitigation insight. development interactive learning media based android education geography. vegetation dispersion green open space universitas pendidikan indonesia. water conservation based local wisdom cikondang traditional village community. driving energy accelerate adiabatic electron dynamics quantum hall system. edutourism development model unesco global geopark ciletuh palabuhanratu sukabumi district. enhancing food security throughout aquaponicsin urban farming development strategy. waste management upi campus campus citizen behaviour towards management zero waste. fast forwad adiabatic quantum dynamics two dimensional dirac equation. spatial dynamics model land use land cover changes comparison ca ann annca. volleyball fundamental movement learning model primary school. modelling number hivaids central sulawesi. estimation ordinary kriging parameters determining characteristics distribution groundwater layer tondo area mantikulore district palu. validity reliability level application measuring school principles decision making. analysis grade vii students learning outcomes animals classification sets using stem approach. design microstrip antenna 2 elements 900 mhz gsm system. predicting forecasting time series models using cluster analysis. learning disaster mitigation problem based learning method senior high school. fostering disaster preparedness school effort build disaster preparedness. travel time efficiency students school bandung regency. feasibility study microbial organic waste processing business sukasari district bandung city. fastforward localphasedregularized spinor massless 21dimensions adiabatic dirac dynamics. mobile gis app guiding geopark unesco global geopark ciletuh palabuhanratu indonesia,"spin systems indonesian, developing students ecological, physiomorphohydro zoning test"
