sinta_id,title,topics
5995101,development computer teaching materials education management applications elearning module. hard skills versus soft skills affect different job types japanese language graduates. development automatic system icmls 20 improving educational technology competences industrial revolution 40. developing integrated management information system research study institute research community services universitas pendidikan indonesia,"educational technology competences, management applications elearning, types japanese language"
5994552,knowledge management process knowledge sharing teacher literacy skills vocational high schools. determinants teacher professional development statesecondary schools. learning facilities improve vocational school productivity,"literacy skills vocational, knowledge management process, schools determinants teacher"
6771601,readiness online learning covid19 pandemic vocational education. digital pedagogical tools effective learning pandemic facilitating tvet students learning process malaysia indonesia. tvet teaching strategy covid19 comparative study indonesia malaysia,"pandemic vocational education, readiness online learning, malaysia indonesia tvet"
5993425,alsumud wa altakayyuf wa altathaquf tabir huwiyat alulamafi almanfabi kampung jawa tondano. implementation backpropagation neural network extreme learning machine ph neutralization prototype. information technology primary school management. ict competences primary school teachers. problem posing skill elementary school students. science learning children learning disabilities. developing mathematical investigative attitudes prospective primary school teachers. ict training curriculum primary school teachers. scaffolding conceptual science. murrderr strategy developing mathematical investigation thinking skill elementary school preservice teacher. implementation signal defects caused effect harmonics use electricity loads,"school teachers ict, neural network extreme, harmonics use electricity"
5993560,decade value education model bibliometric study scopus. alquran literacy strategy learning steps improving alquran reading skills action research. exegetical translation quran action research prospective islamic teachers indonesia. ictbased alquran phonology learning. tourism religion coexist,"alquran literacy strategy, decade value education, learning tourism religion"
6689586,decade value education model bibliometric study scopus. murrderr strategy developing creative characters elementary school prospective teachers. effect endurance eyehand coordination confidence volleyball referee performance west java. activation learners ’ metacognition promote learning autonomy good language learners. static dynamic balance learning primary school students. initial reading lesson dia tampan association method android photo editor media. radec reading answering demonstrating explaining creating lms teach tennis without field practicing. empowering learners roleplaying game vocabulary mastery,"value education model, game vocabulary mastery, coordination confidence volleyball"
6101488,active physics learning contextual teaching learning methods. review continuous professional development school principal carrier. role instructional leadership school quality school climate mediator. influence authentic leadership school culture information communication technology acceptance school management effectiveness public accredited vocational high school west java. promote vision jati diri core identities education. teaching quality mediation contributions principal strategy competency student. effect organisational climate career development organisational citizenship behaviour ocb organisational commitment intervening variable. character education era industrial revolution 40 relevance high school learning transformation process. relationship role principal quality school academic service mediating function teacher commitment. continuing professional development lecturer ’ research training model based research product. grow please model academic supervisory performance. participative leadership implementation character education. discipline enforcement leadership motivation. fluctuation schoolbased management implementation. competencebased education training model management team school operational assistance. transformational leadership headmasters professional learning communities primary schools manjung perak. morality politics relation dirty hands action posibility karl popper minimalist democrac. influence professional learning community malay language teachers transformation school selangor. phenomena leadership consistency implementing quality management vocational high sc. comparative study relationships teacher learning teacher professional development indonesia malaysia. management learning needs potential kindergarten students. improvement teaching effectiveness supervising academic practice grow please model. needs analysis teacher professional development improve competence. knowledge creation higher education leaders facing changes. underdeveloped region education teacher existance access educational policy. authentic leadership human resource practice competitive advantage private madrasas indonesian context. construction project progress evaluation using quantitative approach considering time cost quality. emotional regulation remedy teacher burnout special schools evaluating school climate teacher ’ worklife balance children behavior. use student team achievement divisions improving learning outcome physics course. development classroom climate study indonesia historical perspective. state defense awareness program strengthening student character. improvement leadership capacity lecturer performance optimization student learning outc. influence entrepreneurship education business success graduate recruitment. design twotier supply chain based integration pricing routing inventory control. fourthgrade primary school students misconception greatest common factor least common multiple. effect spiritual intelligence spiritual health covid19 pandemic. studying role spirituality quality work life amongst muslim employees indonesia. synchronization strategic plan implementation legal entity state university good u. school services student perspective study service quality improvement. history ideology new order history school textbook. assessing quality efficiency education rural schools models integration cooperation educational institutions case study russia indonesia. modeling flexible flow shop scheduling problem without unemployment considering sequencedependent preparation times solving metaheuristic algorithm. multiobjective mathematical modeling scheduling machines parallel batch processors. assessing effects gamification developing efl learners idiomatic knowledge attitudinal factors contribute learning idioms game. empirical evaluation educational service quality current higher education system. study role mindfulness intervention based stress reduction psychological distress selfefficacy among health industry staff covid19 pandemic. studying islamic lifestyle academic success russian muslim students. investigating effect using gamebased learning efl learners motivation anxiety,"instructional leadership school, climate study indonesia, ocb organisational commitment"
5983988,projection simulation media technical drawing vocational students. measuring technical drawing capability online learning basic competency vocational students. cipp evaluation learning development model vocational laboratories based iso 9001 2008,"technical drawing vocational, students cipp evaluation, projection simulation media"
5994697,women ’ empowerment family poverty tawhidi epistemological approach,"empowerment family poverty, family poverty tawhidi, tawhidi epistemological approach"
6681604,profile prosocial behavior elementary school children. aggressive behavior elementary school,"children aggressive behavior, behavior elementary school, profile prosocial behavior"
5993706,research based instruction teaching islamic education,"instruction teaching islamic, research based instruction, based instruction teaching"
6715297,managerial leadership green living pharmacy activities development students environmental care elementary schools,"leadership green living, students environmental care, pharmacy activities development"
5979226,gendersensitive effect problembased learning student performance indonesian teacher college classes. development learning content islamic religious education ire courses environmental conservation higher education. teaching licensure boost student learning indonesia ’ answer. implementation integrated education develop intact personality students. wheat flour thermal insulator learning media students hearing impairment. developing computerassisted formative feedback light resource theory case heat concept. kinematic test multimedia formats preliminary validation. effect stembased phenomenon learning improving students correlational reasoning. physics formative feedback game utilization isomorphic multiplechoice items help students learn kinematics. effect stempjbl discovery learning improving students ’ problemsolving skills impulse momentum topic. advance school leadersip progress teaching approach boost learning case indonesia. readdressing teacher challenges case indonesia. finance management costs public private schools indonesia. planning sampling preliminary results indonesian repeat 9th grade survey. exploration students conceptual resource learning heat temperature. improving students intellectual disabilities science process skills photosynthesis experiment enhancing climate change awareness. challenges civic moral educations young muslim indonesian. structural equation model sem matrilineal parenting family community environments adolescent behavior padang city indonesia. microcredit provision lifelong learning productivity poor women indonesian villages. “ rhetoric physics studentteacher ” identity construction indonesian physics studentteacher. webbased student master book information system vocational school muhammadiyah banyuresmi. educationbased augmented reality applications heat learning media content lesson physics. tapioca flour heat insulator learning media students hearing impairments. impact hygiene covid19 pandemic using wheat bread microparticles chemical nutrient content hand hygiene multiplied microorganisms education students special needs. entrepreneurial skills retirement age analysis importance training retiring employees bandung city. entrepreneurial skills retirement age analysis importance training retiring employees bandung city. determinative factors students ’ reading interest community education units bandung. hypnoparenting training improving parent ’ ability parenting,"student learning indonesia, problemsolving skills impulse, gendersensitive effect problembased"
5976354,higherorder thinking skills primary school teachers ’ perceptions islamic education. meridional migration diurnal heavy rainfall extreme events java surrounding waters relation madden julian oscillation. character education pandemic era religious ethical learning model islamic education. theology disaster study west bandung peoples responses potency earthquake. upi students perceptions jihad based regions origin. umrah truly religious tourism. tradition spiritual learning tariqat sequence holy phrases tijaniyah case darussalam boarding school,"perceptions islamic education, higherorder thinking skills, potency earthquake upi"
5995460,integrated multiobjective approach managing supply risks flexible supply chain. using pupil health information management system manage primary school pupils health. challenges implementing ict indonesia national education system industrial revolution era 40,"implementing ict indonesia, managing supply risks, school pupils health"
5977826,determinative factors students ’ reading interest community education units bandung. teaching tyndall effects colloidal system deaf hard hearing students. implementation model character building curriculum 2013 scout movement required extracurricular primary secondary education. role clc social entrepreneurs community empowerment efforts. teaching ph suspension containing colloidal particles suspension students deaf hard hearing. teaching sound reflection using solid objects reflective medium students deaf hard hearing. teaching making dishwashing liquid introduce chemical technology deaf community. community needs analysis software needs assessment analysis naa implementation. teaching colloid system increase respiration children communication barriers. engineering economic analysis production sieve shaker teaching particle size students visual impairment. teaching high school students withwithout special needs misconception corrosion. curriculum heat transfer vocational schools students special needs. teaching pascals law use experimental videos hydraulic concepts everyday products learning process students special needs vocational school students. conceptual model community learning center pkbm indonesia community cultural learning center kominkan japan. conceptual model community learning center pkbm indonesia community cultural learnin. adsorption dye carbon microparticles physicochemical properties adsorption adsorption isotherm education students special needs. influence instagram stories selfexistence university students. determinants teacher professional development statesecondary schools. entrepreneurial skills retirement age analysis importance training retiring employees bandung city. development games instruction within plant growth concept. importance teaching viscosity using experimental demonstration daily products learning process especially students special needs. collaborative teaching heat transfer slow learner students. understanding covid19 particle contagion aerosol droplets students special needs. quality determinant factors inprivate universities. understanding importance implementation health protocols covid19 epidemic student hearing impairment trough experimental demontrations. analysis curriculum science education students special needs vocational high schools. teaching heat transfer solidtoliquid phase transition phenomena students intellectual disabilities. selfregulated learning digital learning environment ’ effect academic achievement pandemic. teaching corrosion iron particles saline water students special needs. rice flour heat insulator learning media students special needs. developing education based national values case nonformal adult education uganda. efforts know rate students analyze synthesize information science social science disciplines multidisciplinary biocommunication study. influence citizenship education content based training towards performance nonformal education instructors. digital literacy women cadres community empowerment rural areas. developing media teach chemical technology students hearing impairments. teaching diffusion process children complex communication needs. learning strategy production tempe various size soybean particles students hearing impairments. experimental demonstration colligative properties solution material phase transition stu. review parenting education program case early childhood education institutions indonesia. local culture valuebased education model sundanese community. role electronic learning media creativity learning. hypnoparenting training improving parent ’ ability parenting,"medium students deaf, introduce chemical technology, community empowerment rural"
