sinta_id,title,topics
5994304,digitalizing museums bibliometric study. puzzle game development learning media learning outcomes building construction basics. improving student learning activities tournament teams games engineering mechanics subjects. transit integrated design porisplawad tangerang transit oriented development area terminal station. efficiency energy office building south jakarta. playful museum design bringing display reality bringing reality display. open flowing design interactive space marketplace. building coverage ratio eastern corridor jalan ir h djuanda bandung. implementation floorarea ratio eastern corridor jalan ir h djuanda bandung,"jakarta playful museum, transit integrated design, learning outcomes building"
6780170,morphological responses lightdemanding alstonia scholaris shadetolerant eusideroxylon zwageri air humidity light intensity. new normal era pandemic covid19 forming responsibility social life culture indonesian society. effects indole acetic acid iaa indole butyric acid iba growth rooting ironwood eusideroxylon zwageri teijsm binn air layering,"alstonia scholaris shadetolerant, indonesian society effects, acid iba growth"
6681695,analytical network process method badminton athletes scholarship recommendations. hybrid principal component analysis knearest neighbour detect catfish disease. early warning system mobilebased impacted areas. web scraping naïve bayes classification job search engine. software assessment model using metrics products egovernment g2b model,"method badminton athletes, software assessment model, detect catfish disease"
5995561,developing technological pedagogical content knowledge tpack animal physiology. perceptions prospective biology teachers scientific argumentation microbiology inquiry lab activities. mastery content representation cores related tpack high school biology teacher. profile information communication technologies ict skills prospective teachers. prospective biology teachers inquiry ability free inquiry learning molecular biology. students stem literacy biotechnology learning junior high school. postseismic coastal development aceh indonesia field observations numerical modeling. development primary school student teachers selfefficacy blended learning. dualmode teacher professional development challenges revisioning future tpd indonesia. feasibility readability test stembased integrated science teaching book model themed blood transportation system body. profile integration earthquake precursor animal knowledge animal ecology course. prospective biology teachers critical thinking skills microbiology argumentbased inquiry laboratory activities. development mlearning vertebrate determination program improve student classification reasoning skills. developing corpus management system bahasa indonesia perisalah project. recursive text segmentation indonesian automated document reader people visual impairment. analyzing socio scientific issues algorithm. pattern student mental representation faced media animation video plant transport relation mental effort. implementation science learning local wisdom approach toward environmental literacy. genetics socio scientific issues measuring rebuttal abilities scientific argumentation. relevance human chromosome analysis activities mutation concept genetics course. analizing student biology education misconception scientific argumentation ability using diagnostic question clusters dqcs molecular genetic concept. analysis biology teachers ’ technological pedagogical content knowledge development lesson study west java indonesia. problem preservice science teachers newtons laws topic case study. identification conceptual understanding biotechnology learning. improving middle school students critical thinking skills reading infusionloaded discovery learning model science instruction. analysis students scientific reasoning ability solving modified lawson classroom test scientific reasoning mlctsr problems applying levels inquiry. learning compost practice university. program integrating education sustainable development esd prospective biology teachers ’ technological pedagogical content knowledge tpack. implementation biotechnology education towards green chemistry teaching bibliometrics study research trends. repackaging radec learning model online mode science class. prospective biology teachers research skills. technological pedagogical content knowledge tpack prospective biology teacher integrating education sustainable development esd learning planning. research educational games stem area 20102020 bibliometric analysis literature. examining disaster literacy modified earthquake laboratory experiment stem learning. disastervulnerable community perception related preearthquake natural phenomena west sumatera part disaster preparedness. implementation integrated science curriculum critical review literature. contribution internet resources mastery genetic concept prospective teachers,"biology teachers inquiry, research skills technological, tpd indonesia feasibility"
5977502,cultural literacy getting know digitalbased folklore,"know digitalbased folklore, cultural literacy getting, getting know digitalbased"
5982918,development portable microcontrollerbased start block performance analysis device sprint athletes. physical activity nutritional status college students covid19 pandemic. physical activity level physical education lesson related fundamental movement skills elementary schools. model development classification homogeneous class learning aquatic. correlation jump performances phases sprinting indonesian sprinters,"device sprint athletes, jump performances phases, class learning aquatic"
6003943,analysis calculation resin requirements process forming carbon fibre body using vacuum infusion method. development algorithm code concept match diesel engine turbocharger. designing adjustable height engine stand reduce risk students musculoskeletal disorders msds engine tune practice,"calculation resin requirements, diesel engine turbocharger, risk students musculoskeletal"
5987645,application problembased learning assisted intelligent learning media improve cognitive aspects students. effectiveness oidde learning model reading infusion strategy trained 21st century students skills momentum impulse materials. selfperceived assessment skill prospective physics teachers. workshop program authentic assessment science teachers. profile prospective physics teachers assessment literacy. attitude level prospective science teachers towards assessment. implementation literacy strategies health technology theme learning enhance indonesian junior high school students physics literacy. systematic review physic laboratory skills assessment instruments based physport nvivo. need analysis developing light waves module threedimensional learning framework. student needs developing light waves test based threedimensional learning frameworks. development multitier openended work energy instrument mowei using rasch analysis identify students misconceptions. design validation smart teaching materials oriented multiple intelligences global warming stm2iglow rasch model analysis. development pendulum oscillation worksheets pows practice science process skills. measuring collaborative problemsolving skills cpss vocational high school students using webbased assessment. evaluation physics learning momentum impulse topic senior high school students. identifying k10 students learning difficulties learning keplers law using worksheet worth,"physics teachers assessment, student needs developing, learning enhance indonesian"
5993378,halal destination images japan visual content analysis. effects doctors ’ interpersonal communication lowincome inpatients ’ satisfaction level. social media emotion politics indonesian case study political environment facebook. influence local government performance budget participatory budget control organizational. communication apprehension levels tourism social sciences students,"tourism social sciences, emotion politics indonesian, doctors interpersonal communication"
5994354,english student teachers deal teaching difficulties teaching practicum,"teaching difficulties teaching, difficulties teaching practicum, english student teachers"
6115166,effect multiple intelligence theory based teaching towards students achievement electrical circuit topic. preservice science teachers understanding chemical multiple representations. interactive animation construction measure students collaborative problem solving skills learning earthquake. preservice science teachers psts creative thinking skills atoms ions molecules digital media creation. gender differences attribution creative thinking experimental evidence using stembased emodule. comparison learning digestion process comic strips endoscopic video effects students achievement contributing factors. preface. assessing preservice science teachers technological pedagogical content knowledge tpack kinematics plant tissue daily life material. assessing high school students proenvironmental behaviour. aesthetics display program learning features validation toward stem based emodule learning integrated science. effect multiple intelligencebased learning towards students concept mastery interest learning matter. investigation science teachers experience integrating digital technology science teaching. investigating preservice science teachers psts technological pedagogical content knowledge extended content representation core,"science teachers technological, teaching investigating preservice, attribution creative thinking"
5990052,establishment student characters citarum river pollution solution program,"pollution solution program, characters citarum river, establishment student characters"
6659655,school location analysis integrating accessibility natural biological hazards support equal access education. land surface temperature changes northen parts bandung basin. multitemporal landsat image utilization spatial prediction built area tasikmalaya city indonesia. land value analysis suburban bandung agricultural land availability impact. conceptual interpretation seismic 3d using rms amplitude dipazimuth attribute analysis identification structure facies model physical geographic. land surface temperature analysis based land cover variations using satellite imagery. correlation land surface temperature vegetation greenness using multitemporal images. linear spectral mixture analysis land cover assessment level subpixel case study tasikmalaya city area based landsat imagery. suggest rubber crops cultivation development zonation west bandung regency,"analysis based land, tasikmalaya city indonesia, temperature vegetation greenness"
6681555,mobile gis app guiding geopark unesco global geopark ciletuh palabuhanratu indonesia. edutourism development model unesco global geopark ciletuh palabuhanratu sukabumi district. multitemporal landsat image utilization spatial prediction built area tasikmalaya city indonesia. mobile guiding application tourists geopark area indonesia. study calcium hydroxide stabilizing agent clay soil toward california bearing ratio unconfined compression value. design development evaluation mobile learning application tourism education. correlation land surface temperature vegetation greenness using multitemporal images. linear spectral mixture analysis land cover assessment level subpixel case study tasikmalaya city area based landsat imagery. suggest rubber crops cultivation development zonation west bandung regency,"district multitemporal landsat, mobile gis app, indonesia study calcium"
257938,multi criteria evaluation regional function based geographic information system. spatial activities models airport based gis dynamic model. analytical hierarchy process ahp determine zoning region vocational education. gismulti criteria evaluation analytical network process determination land capability class suitability residential land. multi criteria evaluation vocational school zone based geographic information system. land suitability evaluation using gisbased logic scoring preference method. multi criteria evaluation vocational school zone based geographic information system. land suitability evaluation using gisbased logic scoring preference method. feasibility prospective analysis logistics engineering study program demands digital business era. literature study theory gisbased multi evaluation criteria. terrain model gridding method variations making topographic maps. environmental management monitoring education building development,"gismulti criteria evaluation, zoning region vocational, logistics engineering study"
6768594,curriculum heat transfer vocational schools students special needs. teaching pascals law use experimental videos hydraulic concepts everyday products learning process students special needs vocational school students. distance learning innovation teaching chemistry vocational school using concept isotherm adsorption carbon microparticles. engineering economic analysis production sieve shaker teaching particle size students visual impairment. wheat flour thermal insulator learning media students hearing impairment. teaching high school students withwithout special needs misconception corrosion. identification misconceptions learning concept adsorption process. rice flour heat insulator learning media students special needs. tapioca flour heat insulator learning media students hearing impairments. teaching heat transfer solidtoliquid phase transition phenomena students intellectual disabilities. isotherm adsorption characteristics carbon microparticles prepared pineapple peel waste. synthesis carbon microparticles red dragon fruit hylocereus undatus peel waste adsorption isotherm characteristics. importance teaching viscosity using experimental demonstration daily products learning process especially students special needs. understanding covid19 particle contagion aerosol droplets students special needs. adsorption dye carbon microparticles physicochemical properties adsorption adsorption isotherm education students special needs. improving learning process producing biocharcoal briquettes durian peelsbanana midrib various particle sizes composition high school students. impact teaching effects dextrin binder composition bamboo fiber dried clove leaves briquettes high school students. examining understanding performance fluid flow viscosity experimental demonstration student special needs. analysis curriculum science education students special needs vocational high schools. students hearing impairments ’ comprehension level towards exam questions natural science lessons. teaching science plant structure student hearing impairments. teaching concept energy students hearing impairment changes electrical energy light heat. teaching science courses gifted students inclusive school. design heat exchanger production synthesis silica. understanding archimedes law best teaching strategies vocational high school students hearing impairment,"heat teaching science, adsorption carbon microparticles, students special needs"
6697084,rumi doping application development antidoping information media indonesian national paralympic comittee athletes,"indonesian national paralympic, rumi doping application, antidoping information media"
6745841,model online trust among adolescents,"online trust adolescents, model online trust"
6000526,influence sustainable tourism development towards tourists satisfaction saung angklung udjo. comparative study local community tourists perceptions concerning development thematic parks city setting. roles heritage tourism preserving urban area,"sustainable tourism development, satisfaction saung angklung, parks city setting"
5994001,exploring emotions single international students hong kong facing covid19 pandemic. teachers strategy implementing english curriculum junior high school indonesia,"pandemic teachers strategy, students hong kong, emotions single international"
5981279,modified laxfriedrichs method shallow water equations. modified laxfriedrichs method shallow water equations. surala ninja mathematics elearning based learning management system alternative learning elementary school. cryptanalysis classical cipher based indonesian language. surfactant effects contact line alteration liquid drop capillary tube. fuzzy evolutionary algorithm solve chromosomes conflict application lecture schedule problems. estimating oil reservoir permeability porosity two interacting wells. bayesian reservoir simulation,"shallow water equations, mathematics elearning based, cipher based indonesian"
6005021,integration sdgs environmental education subjects adiwiyata vocational high school. development learning tools education sustainable development esd integrated problemsolving high school. implementation esd biology learning equip students esd competencies systemic thinking problemsolving. implementation education sustainable development pupils sustainability consciousness adiwiyata school esdbased school. development ethnobotany based local wisdom learning materials improve environmental literacy creative thinking skills. development ethnobotany based local wisdom learning materials improve environmental literacy creative thinking skills. students response project learning online guidance google classroom biology projects. using edmodo assessment learning facilitate improvement 21. developing 21st century student research skills assessment matrix edmodo biology project. profile high school students propositional network representation interpreting convention diagrams,"sustainable development pupils, research skills assessment, esd integrated problemsolving"
6751456,design action primary school students class v high medium group related food themes,"related food themes, action primary school, high medium group"
6005860,counterclaiming crime narrative evaluation defendant ’ plea corruption criminal court. natural language processing python,"crime narrative evaluation, court natural language, language processing python"
5986406,investigation students algebraic proficiency structure sense perspective. symbol sense characteristics designing mathematics tasks. design algebra learning sequence based realistic mathematics education theory case linear equation one variable using balancescales model. validation mathematical teaching materials developed projectbased learning integrated stem. designing algebra learning sequence case operations algebraic expressions. design algebra learning sequence based realistic mathematics education theory case linear equation one variable using balancescales model. predictions students thinking learning system linear equations two variables. use realistic mathematics education theory designing algebra learning sequence case linear equations one variable. designing symbol sense tasks case quadratic equations. expert strategies solving algebraic structure sense problems case quadratic equations. effectiveness discovery learning model mathematical problem solving. students ’ algebraic proficiency perspective symbol sense. use realistic mathematics education theory designing algebra learning sequence case linear equations one variable. predictions students thinking learning system linear equations two variables,"students algebraic proficiency, education theory designing, sense tasks case"
6102047,representation cultural values korean foreign language kfl textbook,"cultural values korean, representation cultural values, language kfl textbook"
6692272,effect body weight training plus low carbohydrate diet versus running plus low carbohydrate diet body fat percentage changes overweight obese young man,"diet versus running, effect body weight, carbohydrate diet body"
5990173,foreign literacy practices learning skills among indonesian thai students graduate education studies. assessing indonesian students competence translating french texts different types. peace pedagogy model development peace culture education setting. exploring values peace cultural contexts indonesian finnish schools study development peace pedagogy,"foreign literacy practices, indonesian students competence, development peace pedagogy"
5978994,curator ’ competency indonesian contemporary art. use laras contemporary gamelan music. cultural art teachers perceptions toward flipped classroom approach. learning simalunguns traditional music senior high school indonesia rhythm pattern gonrang sipitupitu,"indonesian contemporary art, art teachers perceptions, flipped classroom approach"
5994115,nanocurcumin potential increase mitochondrial biogenesis skeletal muscle via ampkpgc1alpha. potential nanocurcumin cytokine storm decreased il6 tnf expression. puree sweet potato substitution wet noodle processing. effect steaming color amount anthocyanin purple sweet potato flour. effect steaming color amount anthocyanin purple sweet potato flour. potential moringa oleifera mitochondrial biogenesis increases total oxphos units expression. selfdirected learning analysis response students using elearning spotupi. effect blanching pretreatment colour anthocyanin dried slice purple sweet potato ipomoea batatas l,"potential nanocurcumin cytokine, moringa oleifera mitochondrial, potato flour effect"
6122897,development ikigai instructional method cultivate computational thinking millennial generations. projectbased learning really effective improve socials skills elementary school students,"cultivate computational thinking, development ikigai instructional, improve socials skills"
6754432,development strength training instruction video virtual community students pandemic era covid19. pattern physical activity sedentary behavior early childhood. relationship students ’ perceived exercise benefit physical activity level covid19 pandemic indonesia. student perception satisfaction internship programs oversea tourism industry. esp textbook development vocational school indonesia. effect muslim womens sportswear jilbab dehydration level thermoregulation exercise,"students perceived exercise, development strength training, covid19 pandemic indonesia"
5993953,requirement engineering method alignment information technology utilization education business strategy. garbage bank elementary schools clean life love environment education. garbage bank elementary schools clean life love environment education. requirement engineering method alignment information technology utilization education business strategy. scheduling cluster server node shutdown based hierarchical kmeans clustering combinations. smart education educational service system equal quality education. creative learning model implementation curriculum learning 2013 achieve 21. creative learning model implementation curriculum 2013 achieve 21st century skills. learning management system lms model based machine learning supports 21st century learning implementation curriculum 2013. knowledge management system kms readiness level based group areas expertise improve science education computer science quality crossfertilization principle case study computer science program course fpmipa upi,"education requirement engineering, management kms readiness, method alignment information"
5978531,analysing diagnostic assessment ratio sine right triangle. kumjianpask algebras desourcification. complex kumjianpask algebras 2graphs. complex kumjianpask algebras. twisted crossed product decomposition. graph algebras crossed product semigroups. group extensions primitive ideal spaces toeplitz algebras. twisted semigroup crossed products twisted toeplitz algebras ordered groups. errors students learning react strategy solving problems mathematical representation ability. analysis students errors responding timss domain algebra problem. kumjianpask algebras finite finitely aligned kgraphs without cycle modules. representations cyclically ordered semigroups. lesson design relationship radian degree. representing kgraphs matrix algebras. crossed products related cyclically ordered semi groups. center kumjianpask algebras associated finitely aligned k graph. decomposition semigroup crossed products. notes complex kumjianpask algebras finitely aligned k graphs. delta diamond fighter kites project geometry class. achievement analysis indonesian timss 2011 mathematics towards didactical situation. study limit computeraided learning conceptualconflict strategy. ratios right triangle unit circle introduction trigonometric functions. epistemological obstacle topic triangle quadrilateral. investigating 10. teacher images derivatives concept. identifying secondary school students misconceptions number. linear cyclically ordered subgroups cyclically ordered groups. cyclically ordered group c. epistemological obstacle transformation geometry based van hiele ’ level. inclusion properties weighted weak orlicz spaces. autonomy creative thinking skills prospective elementary school teacher students learning mathematics science phenomena assisted learning management system. level preservice mathematics teachers reflective thinking. transposition spheres volume based didactic phenomena. error analysis solving rational irrational inequalities. cyclically ordered groups direct product. error analysis solving rational irrational inequalities. analysis students learning difficulties system linear equation two variables topic. cyclically ordered groups direct product,"triangle kumjianpask algebras, aligned kgraphs cycle, computeraided learning conceptualconflict"
